{
  "contract_version": "1.0.0",
  "source_commit": "4a629f313ee411282478cd0e15b948a7bd02c9a3",
  "source_tree_clean": true,
  "command": ["bin/adlc", "ci", "--json"],
  "started_at": "2026-07-15T03:55:25Z",
  "finished_at": "2026-07-15T03:58:28Z",
  "status": "pass",
  "suite_count": 10,
  "suites": [
    {"name": "health-check", "status": "pass", "returncode": 0, "duration_ms": 179, "command": ["bin/adlc", "health-check", "--json"]},
    {"name": "cli", "status": "pass", "returncode": 0, "duration_ms": 45222, "command": ["bash", "tests/test_adlc_cli.sh"]},
    {"name": "contracts", "status": "pass", "returncode": 0, "duration_ms": 57074, "command": ["bash", "tests/test_adlc_contracts.sh"]},
    {"name": "setup", "status": "pass", "returncode": 0, "duration_ms": 52318, "command": ["bash", "tests/test_setup.sh"]},
    {"name": "drift", "status": "pass", "returncode": 0, "duration_ms": 14042, "command": ["bash", "tests/test_drift_verification.sh"]},
    {"name": "acceptance", "status": "pass", "returncode": 0, "duration_ms": 5210, "command": ["bash", "tests/acceptance/run_public_acceptance.sh"]},
    {"name": "os12-acceptance", "status": "pass", "returncode": 0, "duration_ms": 1764, "command": ["bash", "tests/acceptance/run_os12_acceptance.sh"]},
    {"name": "backtest", "status": "pass", "returncode": 0, "duration_ms": 1347, "command": ["bash", "tests/backtest/run_backtest.sh"]},
    {"name": "public-hygiene", "status": "pass", "returncode": 0, "duration_ms": 506, "command": ["bash", "tests/test_public_hygiene.sh"]},
    {"name": "py-compile", "status": "pass", "returncode": 0, "duration_ms": 94, "command": ["python3", "-m", "py_compile", "scripts/adlc.py", "scripts/adlc_runtime/__init__.py", "scripts/adlc_runtime/cli.py", "scripts/adlc_runtime/hooks.py", "scripts/adlc_runtime/install.py", "scripts/adlc_runtime/metadata.py", "scripts/adlc_runtime/provider_targets.py", "scripts/adlc_runtime/public_facade.py", "scripts/adlc_runtime/skill_compiler.py", "scripts/md2pdf.py", "scripts/validate_learning_entry.py"]}
  ],
  "no_overclaim": "This attests only that the canonical repository CI command passed in a clean detached worktree at the named source commit."
}
